{
  "assess_version": "1",
  "assessed_date": "20260615",
  "assessor": "56687218+Vasquomw21@users.noreply.github.com",
  "assessor_tool": "assess_record.py",
  "body_sha256": "45b4515bc8a76f3bfa2daf533660acaa033cc16983cca0df99d0ad7257ec41f2",
  "disputes": [],
  "grounding": [
    "zhong_2021:eggs-less-healthy-substitution"
  ],
  "id": "zhong2021-supports-zhao-apt-pass",
  "kind": "faithfulness-pass",
  "record_sha256": "46e2bbe2e3f13186e7bac1c0047cb91d4c484f634811bd6d7d10a071da84eef5",
  "reviews": [
    "zhong2021-supports-zhao-apt"
  ],
  "span": "",
  "subject": "zhao_2022:harmful-mortality"
}
