{
  "assess_version": "1",
  "assessed_date": "20260615",
  "assessor": "56687218+Vasquomw21@users.noreply.github.com",
  "assessor_tool": "assess_record.py",
  "body_sha256": "092f9d112dbce8fe7c1715d6efa9bbe88d640e53351fa67d3d8a853c1a5a7cc5",
  "disputes": [],
  "grounding": [
    "giddings_reply_2008:scenario-inconsistent"
  ],
  "id": "reply-rebuts-plaga-apt-pass",
  "kind": "faithfulness-pass",
  "record_sha256": "3e9a8eb94cd08a7d79e483a597271a3ab0cb86db8b4df336f5df2389b2d8dc2e",
  "reviews": [
    "reply-rebuts-plaga-apt"
  ],
  "span": "",
  "subject": "plaga_2008:harmful-scenario"
}
