{
  "assess_version": "1",
  "assessed_date": "20260614",
  "assessor": "56687218+Vasquomw21@users.noreply.github.com",
  "assessor_tool": "assess_record.py",
  "body_sha256": "00f5708cf56c25032c729d1e1889d1d0d07c9efdd32b154e988becd842a8563a",
  "disputes": [],
  "grounding": [
    "worobey_2022:market-early-epicenter"
  ],
  "id": "worobey-supports-nolab-apt",
  "kind": "edge",
  "record_sha256": "28e1497a778608a2539e5eeaabbc6390e2f87bdfe3e8a86cf84350f183c43fa2",
  "span": "",
  "subject": "andersen_2020:no-lab-scenario"
}
