{
  "assess_version": "1",
  "assessed_date": "20260615",
  "assessor": "56687218+Vasquomw21@users.noreply.github.com",
  "assessor_tool": "assess_record.py",
  "body_sha256": "45b4515bc8a76f3bfa2daf533660acaa033cc16983cca0df99d0ad7257ec41f2",
  "disputes": [],
  "grounding": [
    "zhuang_2021:egg-cholesterol-higher-mortality"
  ],
  "id": "zhuang-supports-zhao-apt-pass",
  "kind": "faithfulness-pass",
  "record_sha256": "4de3b7b7e3be14ab637dffaeaf5a24c5ba5c653db5de65ed7d2e3906c530765f",
  "reviews": [
    "zhuang-supports-zhao-apt"
  ],
  "span": "",
  "subject": "zhao_2022:harmful-mortality"
}
