{
  "assess_version": "1",
  "assessed_date": "20260614",
  "assessor": "56687218+Vasquomw21@users.noreply.github.com",
  "assessor_tool": "assess_record.py",
  "body_sha256": "00f5708cf56c25032c729d1e1889d1d0d07c9efdd32b154e988becd842a8563a",
  "disputes": [],
  "grounding": [
    "pekar_2022:multiple-introductions"
  ],
  "id": "pekar-supports-nolab-apt",
  "kind": "edge",
  "record_sha256": "e7f095e910275382ee983a6a12abd5a15120181596a8effe6d15c7a51de1bcde",
  "span": "",
  "subject": "andersen_2020:no-lab-scenario"
}
