{
  "assess_version": "1",
  "assessed_date": "20260615",
  "assessor": "56687218+Vasquomw21@users.noreply.github.com",
  "assessor_tool": "assess_record.py",
  "body_sha256": "45b4515bc8a76f3bfa2daf533660acaa033cc16983cca0df99d0ad7257ec41f2",
  "disputes": [],
  "grounding": [
    "zhong_2021:eggs-less-healthy-substitution"
  ],
  "id": "zhong2021-supports-zhao-apt",
  "kind": "edge",
  "record_sha256": "fba28da42f1e55657f7516d6bd2e748916094e2b1ad7d6fee27a0ff70a2a7080",
  "span": "",
  "subject": "zhao_2022:harmful-mortality"
}
