{
  "assess_version": "1",
  "assessed_date": "20260615",
  "assessor": "56687218+Vasquomw21@users.noreply.github.com",
  "assessor_tool": "assess_record.py",
  "body_sha256": "29abeaff6b92042fef6ee880f0ec35dc6173c3603daebb569370f2fdfa05f799",
  "disputes": [],
  "grounding": [
    "cerezo_2021:vqa-unproven-scaling"
  ],
  "id": "cerezo-supports-noqml-apt-pass",
  "kind": "faithfulness-pass",
  "record_sha256": "7388f21bdab8b3aa8b60770fb140b64fca231430200f318a94c6463b2c6874ec",
  "reviews": [
    "cerezo-supports-noqml-apt"
  ],
  "span": "",
  "subject": "maurizio_2025:no-qml-real-world-speedup"
}
