{
  "assess_version": "1",
  "assessed_date": "20260615",
  "assessor": "56687218+Vasquomw21@users.noreply.github.com",
  "assessor_tool": "assess_record.py",
  "body_sha256": "29abeaff6b92042fef6ee880f0ec35dc6173c3603daebb569370f2fdfa05f799",
  "disputes": [],
  "grounding": [
    "chia_2020:svt-no-exponential-speedup"
  ],
  "id": "chia-supports-noqml-apt-pass",
  "kind": "faithfulness-pass",
  "record_sha256": "40f2006556ad30b986db0da76394a6d3c1d62816568b86f06a72a04b8eeb206f",
  "reviews": [
    "chia-supports-noqml-apt"
  ],
  "span": "",
  "subject": "maurizio_2025:no-qml-real-world-speedup"
}
