{
  "assess_version": "1",
  "assessed_date": "20260615",
  "assessor": "56687218+Vasquomw21@users.noreply.github.com",
  "assessor_tool": "assess_record.py",
  "body_sha256": "f9c72cf8e07ae7d105890da31d8ff15577e4f28842e02ea803a941e9cd9fac2a",
  "disputes": [],
  "grounding": [
    "dehghan_2020:pure-no-association"
  ],
  "id": "dehghan-supports-drouin-apt",
  "kind": "edge",
  "record_sha256": "9d36fb6d4d12cf291d1df5a9021eda552cc5055e40b41f89adac88be11b04327",
  "span": "",
  "subject": "drouin_2020:no-association-overall"
}
